title,description,summary,installs,minInstalls,realInstalls,score,ratings,reviews,histogram,price,free,currency,sale,saleTime,originalPrice,saleText,offersIAP,inAppProductPrice,developer,developerId,developerEmail,developerWebsite,developerAddress,privacyPolicy,genre,genreId,categories,contentRating,contentRatingDescription,adSupported,containsAds,released,updated,version,comments,appId,url,searchMoment,countryCode,languageCode
Pawmates: The Dog Meetup App,"Featured on 50+ news and media channels including BlogTO, Narcity, Newsweek, CTV, City News, Global News, Curiocity, and many more

Downloaded more than 50,000 times in 20+ countries

Pawmates is your friendly neighbourhood dog meetup app! Match, chat, and meet with dogs and their owners near you!

Find your pack! Looking to meet with like minded people who love their pets like you do? Look no further! Our matching works just like your favourite meetup apps. Swipe right on pups you like, left on those you don’t. Once you’ve matched with them, you can chat freely as much as you want, for free. We do NOT believe in pay to message (who wants to do that?)

Our features include:

CREATE YOUR CUSTOM PROFILE
Post photos of your pup, add details about them including their personality, age, breed, and more!

MATCH WITH PUPS
Unlimited free browsing of the cutest dogs in your area! Change your settings to specify the types of dogs and people you want to meet! Find your gang!

CHAT AND MEET
Pawmates matches show up on your custom wheel! Swipe through your match wheel and start chatting with people and their pups!
Connect with pups near you by organizing meet ups!

OUR PET BUSINESS MAP

Looking for the top rated vets, pet food stores, walkers, or anything else related to your pup like the best park in your area? Hop on over to our Pawmates Map and check out every animal business in your area!

Pawmates is here not only to help you meet your new dogpack, but to help with every other need of pet owners and we're growing daily! We want to build the biggest community of dog lovers around the world. So come join our family today!

CONTACT US!
Have questions, problems, or feedback? Feel free to contact us @ Pawmatesapp@gmail.com Or visit us at our Instagram and Facebook pages to win amazing prizes and giveaways!

YOUR PRIVACY IS IMPORTANT TO US
Please read the terms and policies of Pawmates, as well as the privacy policy carefully. All data is handled under the terms and policies of Pawmates privacy policy. More details can be found here: https://pawmatesapp.com/terms-of-service/","Match, chat, and meet dogs and their owners near you","5,000+",5000,8914,0.0,0.0,0.0,"[0, 0, 0, 0, 0]",0.0,True,JPY,False,,,,False,,Slopestyle Studios,Slopestyle+Studios,pawmatesapp@gmail.com,https://pawmatesapp.com/,,https://pawmatesapp.com/terms-of-service/,Social,SOCIAL,"[{'name': 'Lifestyle', 'id': 'LIFESTYLE'}, {'name': 'Simulation', 'id': 'GAME_SIMULATION'}, {'name': 'Care', 'id': None}, {'name': 'Pet', 'id': None}, {'name': 'Casual', 'id': 'GAME_CASUAL'}, {'name': 'Single player', 'id': None}, {'name': 'Stylized', 'id': None}, {'name': 'Simulation', 'id': 'GAME_SIMULATION'}, {'name': 'Care', 'id': None}, {'name': 'Pet', 'id': None}, {'name': 'Casual', 'id': 'GAME_CASUAL'}, {'name': 'Single player', 'id': None}, {'name': 'Stylized', 'id': None}, {'name': 'Simulation', 'id': 'GAME_SIMULATION'}, {'name': 'Care', 'id': None}, {'name': 'Pet', 'id': None}, {'name': 'Casual', 'id': 'GAME_CASUAL'}, {'name': 'Single player', 'id': None}, {'name': 'Stylized', 'id': None}, {'name': 'Simulation', 'id': 'GAME_SIMULATION'}, {'name': 'Care', 'id': None}, {'name': 'Pet', 'id': None}, {'name': 'Casual', 'id': 'GAME_CASUAL'}, {'name': 'Single player', 'id': None}, {'name': 'Stylized', 'id': None}, {'name': 'Action', 'id': 'GAME_ACTION'}, {'name': 'Shooter', 'id': None}, {'name': 'Tactical shooter', 'id': None}, {'name': 'Casual', 'id': 'GAME_CASUAL'}, {'name': 'Stylized', 'id': None}, {'name': 'Simulation', 'id': 'GAME_SIMULATION'}, {'name': 'Idle', 'id': None}, {'name': 'Casual', 'id': 'GAME_CASUAL'}, {'name': 'Single player', 'id': None}, {'name': 'Stylized', 'id': None}, {'name': 'Cartoon', 'id': None}, {'name': 'Offline', 'id': None}, {'name': 'Simulation', 'id': 'GAME_SIMULATION'}, {'name': 'Idle', 'id': None}, {'name': 'Casual', 'id': 'GAME_CASUAL'}, {'name': 'Single player', 'id': None}, {'name': 'Stylized', 'id': None}, {'name': 'Cartoon', 'id': None}, {'name': 'Offline', 'id': None}, {'name': 'Simulation', 'id': 'GAME_SIMULATION'}, {'name': 'Care', 'id': None}, {'name': 'Pet', 'id': None}, {'name': 'Casual', 'id': 'GAME_CASUAL'}, {'name': 'Single player', 'id': None}, {'name': 'Stylized', 'id': None}, {'name': 'Simulation', 'id': 'GAME_SIMULATION'}, {'name': 'Idle', 'id': None}, {'name': 'Casual', 'id': 'GAME_CASUAL'}, {'name': 'Single player', 'id': None}, {'name': 'Stylized', 'id': None}, {'name': 'Cartoon', 'id': None}, {'name': 'Offline', 'id': None}, {'name': 'Simulation', 'id': 'GAME_SIMULATION'}, {'name': 'Idle', 'id': None}, {'name': 'Casual', 'id': 'GAME_CASUAL'}, {'name': 'Single player', 'id': None}, {'name': 'Stylized', 'id': None}, {'name': 'Cartoon', 'id': None}, {'name': 'Offline', 'id': None}, {'name': 'Simulation', 'id': 'GAME_SIMULATION'}, {'name': 'Idle', 'id': None}, {'name': 'Casual', 'id': 'GAME_CASUAL'}, {'name': 'Single player', 'id': None}, {'name': 'Stylized', 'id': None}, {'name': 'Cartoon', 'id': None}, {'name': 'Offline', 'id': None}, {'name': 'Simulation', 'id': 'GAME_SIMULATION'}, {'name': 'Idle', 'id': None}, {'name': 'Casual', 'id': 'GAME_CASUAL'}, {'name': 'Single player', 'id': None}, {'name': 'Stylized', 'id': None}, {'name': 'Cartoon', 'id': None}, {'name': 'Offline', 'id': None}, {'name': 'Simulation', 'id': 'GAME_SIMULATION'}, {'name': 'Idle', 'id': None}, {'name': 'Casual', 'id': 'GAME_CASUAL'}, {'name': 'Single player', 'id': None}, {'name': 'Stylized', 'id': None}, {'name': 'Cartoon', 'id': None}, {'name': 'Offline', 'id': None}, {'name': 'Action', 'id': 'GAME_ACTION'}, {'name': 'Shooter', 'id': None}, {'name': 'Tactical shooter', 'id': None}, {'name': 'Casual', 'id': 'GAME_CASUAL'}, {'name': 'Stylized', 'id': None}, {'name': 'Simulation', 'id': 'GAME_SIMULATION'}, {'name': 'Idle', 'id': None}, {'name': 'Casual', 'id': 'GAME_CASUAL'}, {'name': 'Single player', 'id': None}, {'name': 'Stylized', 'id': None}, {'name': 'Cartoon', 'id': None}, {'name': 'Offline', 'id': None}, {'name': 'Simulation', 'id': 'GAME_SIMULATION'}, {'name': 'Idle', 'id': None}, {'name': 'Casual', 'id': 'GAME_CASUAL'}, {'name': 'Single player', 'id': None}, {'name': 'Stylized', 'id': None}, {'name': 'Cartoon', 'id': None}, {'name': 'Offline', 'id': None}, {'name': 'Simulation', 'id': 'GAME_SIMULATION'}, {'name': 'Idle', 'id': None}, {'name': 'Casual', 'id': 'GAME_CASUAL'}, {'name': 'Single player', 'id': None}, {'name': 'Stylized', 'id': None}, {'name': 'Cartoon', 'id': None}, {'name': 'Offline', 'id': None}, {'name': 'Simulation', 'id': 'GAME_SIMULATION'}, {'name': 'Idle', 'id': None}, {'name': 'Casual', 'id': 'GAME_CASUAL'}, {'name': 'Single player', 'id': None}, {'name': 'Stylized', 'id': None}, {'name': 'Cartoon', 'id': None}, {'name': 'Offline', 'id': None}, {'name': 'Simulation', 'id': 'GAME_SIMULATION'}, {'name': 'Idle', 'id': None}, {'name': 'Casual', 'id': 'GAME_CASUAL'}, {'name': 'Single player', 'id': None}, {'name': 'Stylized', 'id': None}, {'name': 'Cartoon', 'id': None}, {'name': 'Offline', 'id': None}, {'name': 'Simulation', 'id': 'GAME_SIMULATION'}, {'name': 'Idle', 'id': None}, {'name': 'Casual', 'id': 'GAME_CASUAL'}, {'name': 'Single player', 'id': None}, {'name': 'Stylized', 'id': None}, {'name': 'Cartoon', 'id': None}, {'name': 'Offline', 'id': None}, {'name': 'Simulation', 'id': 'GAME_SIMULATION'}, {'name': 'Idle', 'id': None}, {'name': 'Casual', 'id': 'GAME_CASUAL'}, {'name': 'Single player', 'id': None}, {'name': 'Stylized', 'id': None}, {'name': 'Cartoon', 'id': None}, {'name': 'Offline', 'id': None}, {'name': 'Simulation', 'id': 'GAME_SIMULATION'}, {'name': 'Idle', 'id': None}, {'name': 'Casual', 'id': 'GAME_CASUAL'}, {'name': 'Single player', 'id': None}, {'name': 'Stylized', 'id': None}, {'name': 'Cartoon', 'id': None}, {'name': 'Offline', 'id': None}, {'name': 'Simulation', 'id': 'GAME_SIMULATION'}, {'name': 'Idle', 'id': None}, {'name': 'Casual', 'id': 'GAME_CASUAL'}, {'name': 'Single player', 'id': None}, {'name': 'Stylized', 'id': None}, {'name': 'Cartoon', 'id': None}, {'name': 'Offline', 'id': None}, {'name': 'Simulation', 'id': 'GAME_SIMULATION'}, {'name': 'Care', 'id': None}, {'name': 'Pet', 'id': None}, {'name': 'Casual', 'id': 'GAME_CASUAL'}, {'name': 'Single player', 'id': None}, {'name': 'Stylized', 'id': None}, {'name': 'Simulation', 'id': 'GAME_SIMULATION'}, {'name': 'Care', 'id': None}, {'name': 'Pet', 'id': None}, {'name': 'Casual', 'id': 'GAME_CASUAL'}, {'name': 'Single player', 'id': None}, {'name': 'Realistic', 'id': None}, {'name': 'Simulation', 'id': 'GAME_SIMULATION'}, {'name': 'Care', 'id': None}, {'name': 'Pet', 'id': None}, {'name': 'Casual', 'id': 'GAME_CASUAL'}, {'name': 'Single player', 'id': None}, {'name': 'Stylized', 'id': None}, {'name': 'Cartoon', 'id': None}, {'name': 'Offline', 'id': None}, {'name': 'Simulation', 'id': 'GAME_SIMULATION'}, {'name': 'Care', 'id': None}, {'name': 'Pet', 'id': None}, {'name': 'Casual', 'id': 'GAME_CASUAL'}, {'name': 'Single player', 'id': None}, {'name': 'Realistic', 'id': None}, {'name': 'Simulation', 'id': 'GAME_SIMULATION'}, {'name': 'Care', 'id': None}, {'name': 'Pet', 'id': None}, {'name': 'Casual', 'id': 'GAME_CASUAL'}, {'name': 'Single player', 'id': None}, {'name': 'Stylized', 'id': None}, {'name': 'Cartoon', 'id': None}, {'name': 'Offline', 'id': None}, {'name': 'Simulation', 'id': 'GAME_SIMULATION'}, {'name': 'Care', 'id': None}, {'name': 'Pet', 'id': None}, {'name': 'Casual', 'id': 'GAME_CASUAL'}, {'name': 'Single player', 'id': None}, {'name': 'Stylized', 'id': None}, {'name': 'Simulation', 'id': 'GAME_SIMULATION'}, {'name': 'Care', 'id': None}, {'name': 'Pet', 'id': None}, {'name': 'Casual', 'id': 'GAME_CASUAL'}, {'name': 'Single player', 'id': None}, {'name': 'Realistic', 'id': None}, {'name': 'Simulation', 'id': 'GAME_SIMULATION'}, {'name': 'Care', 'id': None}, {'name': 'Pet', 'id': None}, {'name': 'Casual', 'id': 'GAME_CASUAL'}, {'name': 'Single player', 'id': None}, {'name': 'Realistic', 'id': None}, {'name': 'Simulation', 'id': 'GAME_SIMULATION'}, {'name': 'Care', 'id': None}, {'name': 'Pet', 'id': None}, {'name': 'Casual', 'id': 'GAME_CASUAL'}, {'name': 'Single player', 'id': None}, {'name': 'Stylized', 'id': None}, {'name': 'Cartoon', 'id': None}, {'name': 'Offline', 'id': None}, {'name': 'Simulation', 'id': 'GAME_SIMULATION'}, {'name': 'Management', 'id': None}, {'name': 'Tycoon', 'id': None}, {'name': 'Casual', 'id': 'GAME_CASUAL'}, {'name': 'Single player', 'id': None}, {'name': 'Stylized', 'id': None}, {'name': 'Offline', 'id': None}, {'name': 'Simulation', 'id': 'GAME_SIMULATION'}, {'name': 'Care', 'id': None}, {'name': 'Pet', 'id': None}, {'name': 'Casual', 'id': 'GAME_CASUAL'}, {'name': 'Single player', 'id': None}, {'name': 'Stylized', 'id': None}, {'name': 'Offline', 'id': None}, {'name': 'Simulation', 'id': 'GAME_SIMULATION'}, {'name': 'Life', 'id': None}, {'name': 'Dating', 'id': None}, {'name': 'Casual', 'id': 'GAME_CASUAL'}, {'name': 'Single player', 'id': None}, {'name': 'Stylized', 'id': None}, {'name': 'Anime', 'id': None}, {'name': 'Simulation', 'id': 'GAME_SIMULATION'}, {'name': 'Care', 'id': None}, {'name': 'Pet', 'id': None}, {'name': 'Casual', 'id': 'GAME_CASUAL'}, {'name': 'Single player', 'id': None}, {'name': 'Stylized', 'id': None}, {'name': 'Cartoon', 'id': None}, {'name': 'Offline', 'id': None}, {'name': 'Racing', 'id': 'GAME_RACING'}, {'name': 'Casual', 'id': 'GAME_CASUAL'}, {'name': 'Single player', 'id': None}, {'name': 'Stylized', 'id': None}, {'name': 'Pixelated', 'id': None}, {'name': 'Offline', 'id': None}, {'name': 'Simulation', 'id': 'GAME_SIMULATION'}, {'name': 'Care', 'id': None}, {'name': 'Pet', 'id': None}, {'name': 'Casual', 'id': 'GAME_CASUAL'}, {'name': 'Single player', 'id': None}, {'name': 'Stylized', 'id': None}, {'name': 'Simulation', 'id': 'GAME_SIMULATION'}, {'name': 'Management', 'id': None}, {'name': 'Tycoon', 'id': None}, {'name': 'Casual', 'id': 'GAME_CASUAL'}, {'name': 'Single player', 'id': None}, {'name': 'Stylized', 'id': None}, {'name': 'Offline', 'id': None}, {'name': 'Simulation', 'id': 'GAME_SIMULATION'}, {'name': 'Care', 'id': None}, {'name': 'Pet', 'id': None}, {'name': 'Casual', 'id': 'GAME_CASUAL'}, {'name': 'Single player', 'id': None}, {'name': 'Stylized', 'id': None}, {'name': 'Offline', 'id': None}, {'name': 'Simulation', 'id': 'GAME_SIMULATION'}, {'name': 'Idle', 'id': None}, {'name': 'Casual', 'id': 'GAME_CASUAL'}, {'name': 'Single player', 'id': None}, {'name': 'Stylized', 'id': None}, {'name': 'Cartoon', 'id': None}, {'name': 'Offline', 'id': None}, {'name': 'Simulation', 'id': 'GAME_SIMULATION'}, {'name': 'Care', 'id': None}, {'name': 'Pet', 'id': None}, {'name': 'Casual', 'id': 'GAME_CASUAL'}, {'name': 'Single player', 'id': None}, {'name': 'Realistic', 'id': None}, {'name': 'Simulation', 'id': 'GAME_SIMULATION'}, {'name': 'Care', 'id': None}, {'name': 'Pet', 'id': None}, {'name': 'Casual', 'id': 'GAME_CASUAL'}, {'name': 'Single player', 'id': None}, {'name': 'Stylized', 'id': None}, {'name': 'Offline', 'id': None}, {'name': 'Simulation', 'id': 'GAME_SIMULATION'}, {'name': 'Life', 'id': None}, {'name': 'Dating', 'id': None}, {'name': 'Casual', 'id': 'GAME_CASUAL'}, {'name': 'Single player', 'id': None}, {'name': 'Stylized', 'id': None}, {'name': 'Anime', 'id': None}, {'name': 'Simulation', 'id': 'GAME_SIMULATION'}, {'name': 'Care', 'id': None}, {'name': 'Pet', 'id': None}, {'name': 'Casual', 'id': 'GAME_CASUAL'}, {'name': 'Single player', 'id': None}, {'name': 'Stylized', 'id': None}, {'name': 'Cartoon', 'id': None}, {'name': 'Offline', 'id': None}, {'name': 'Simulation', 'id': 'GAME_SIMULATION'}, {'name': 'Care', 'id': None}, {'name': 'Pet', 'id': None}, {'name': 'Casual', 'id': 'GAME_CASUAL'}, {'name': 'Single player', 'id': None}, {'name': 'Stylized', 'id': None}, {'name': 'Cartoon', 'id': None}, {'name': 'Offline', 'id': None}, {'name': 'Simulation', 'id': 'GAME_SIMULATION'}, {'name': 'Care', 'id': None}, {'name': 'Pet', 'id': None}, {'name': 'Casual', 'id': 'GAME_CASUAL'}, {'name': 'Single player', 'id': None}, {'name': 'Stylized', 'id': None}, {'name': 'Offline', 'id': None}, {'name': 'Simulation', 'id': 'GAME_SIMULATION'}, {'name': 'Care', 'id': None}, {'name': 'Pet', 'id': None}, {'name': 'Casual', 'id': 'GAME_CASUAL'}, {'name': 'Single player', 'id': None}, {'name': 'Stylized', 'id': None}, {'name': 'Cartoon', 'id': None}, {'name': 'Offline', 'id': None}, {'name': 'Simulation', 'id': 'GAME_SIMULATION'}, {'name': 'Management', 'id': None}, {'name': 'Tycoon', 'id': None}, {'name': 'Casual', 'id': 'GAME_CASUAL'}, {'name': 'Single player', 'id': None}, {'name': 'Stylized', 'id': None}, {'name': 'Offline', 'id': None}, {'name': 'Simulation', 'id': 'GAME_SIMULATION'}, {'name': 'Care', 'id': None}, {'name': 'Pet', 'id': None}, {'name': 'Casual', 'id': 'GAME_CASUAL'}, {'name': 'Single player', 'id': None}, {'name': 'Realistic', 'id': None}, {'name': 'Simulation', 'id': 'GAME_SIMULATION'}, {'name': 'Idle', 'id': None}, {'name': 'Casual', 'id': 'GAME_CASUAL'}, {'name': 'Single player', 'id': None}, {'name': 'Stylized', 'id': None}, {'name': 'Cartoon', 'id': None}, {'name': 'Offline', 'id': None}, {'name': 'Simulation', 'id': 'GAME_SIMULATION'}, {'name': 'Care', 'id': None}, {'name': 'Pet', 'id': None}, {'name': 'Casual', 'id': 'GAME_CASUAL'}, {'name': 'Single player', 'id': None}, {'name': 'Stylized', 'id': None}, {'name': 'Puzzle', 'id': 'GAME_PUZZLE'}, {'name': 'Merge', 'id': None}, {'name': 'Casual', 'id': 'GAME_CASUAL'}, {'name': 'Single player', 'id': None}, {'name': 'Stylized', 'id': None}, {'name': 'Cartoon', 'id': None}, {'name': 'Offline', 'id': None}, {'name': 'Simulation', 'id': 'GAME_SIMULATION'}, {'name': 'Life', 'id': None}, {'name': 'Dating', 'id': None}, {'name': 'Casual', 'id': 'GAME_CASUAL'}, {'name': 'Single player', 'id': None}, {'name': 'Stylized', 'id': None}, {'name': 'Anime', 'id': None}, {'name': 'Trivia', 'id': 'GAME_TRIVIA'}, {'name': 'Casual', 'id': 'GAME_CASUAL'}, {'name': 'Single player', 'id': None}, {'name': 'Realistic', 'id': None}, {'name': 'Simulation', 'id': 'GAME_SIMULATION'}, {'name': 'Care', 'id': None}, {'name': 'Pet', 'id': None}, {'name': 'Casual', 'id': 'GAME_CASUAL'}, {'name': 'Single player', 'id': None}, {'name': 'Stylized', 'id': None}, {'name': 'Cartoon', 'id': None}, {'name': 'Offline', 'id': None}, {'name': 'Puzzle', 'id': 'GAME_PUZZLE'}, {'name': 'Merge', 'id': None}, {'name': 'Casual', 'id': 'GAME_CASUAL'}, {'name': 'Single player', 'id': None}, {'name': 'Stylized', 'id': None}, {'name': 'Offline', 'id': None}, {'name': 'Simulation', 'id': 'GAME_SIMULATION'}, {'name': 'Care', 'id': None}, {'name': 'Pet', 'id': None}, {'name': 'Casual', 'id': 'GAME_CASUAL'}, {'name': 'Single player', 'id': None}, {'name': 'Stylized', 'id': None}, {'name': 'Simulation', 'id': 'GAME_SIMULATION'}, {'name': 'Management', 'id': None}, {'name': 'Tycoon', 'id': None}, {'name': 'Casual', 'id': 'GAME_CASUAL'}, {'name': 'Single player', 'id': None}, {'name': 'Stylized', 'id': None}, {'name': 'Offline', 'id': None}, {'name': 'Simulation', 'id': 'GAME_SIMULATION'}, {'name': 'Life', 'id': None}, {'name': 'Dating', 'id': None}, {'name': 'Casual', 'id': 'GAME_CASUAL'}, {'name': 'Single player', 'id': None}, {'name': 'Stylized', 'id': None}, {'name': 'Anime', 'id': None}, {'name': 'Puzzle', 'id': 'GAME_PUZZLE'}, {'name': 'Match 3', 'id': None}, {'name': 'Casual', 'id': 'GAME_CASUAL'}, {'name': 'Single player', 'id': None}, {'name': 'Stylized', 'id': None}, {'name': 'Offline', 'id': None}, {'name': 'Simulation', 'id': 'GAME_SIMULATION'}, {'name': 'Care', 'id': None}, {'name': 'Pet', 'id': None}, {'name': 'Casual', 'id': 'GAME_CASUAL'}, {'name': 'Single player', 'id': None}, {'name': 'Realistic', 'id': None}, {'name': 'Simulation', 'id': 'GAME_SIMULATION'}, {'name': 'Care', 'id': None}, {'name': 'Pet', 'id': None}, {'name': 'Casual', 'id': 'GAME_CASUAL'}, {'name': 'Single player', 'id': None}, {'name': 'Stylized', 'id': None}, {'name': 'Cartoon', 'id': None}, {'name': 'Offline', 'id': None}, {'name': 'Trivia', 'id': 'GAME_TRIVIA'}, {'name': 'Casual', 'id': 'GAME_CASUAL'}, {'name': 'Single player', 'id': None}, {'name': 'Realistic', 'id': None}, {'name': 'Simulation', 'id': 'GAME_SIMULATION'}, {'name': 'Care', 'id': None}, {'name': 'Pet', 'id': None}, {'name': 'Casual', 'id': 'GAME_CASUAL'}, {'name': 'Single player', 'id': None}, {'name': 'Realistic', 'id': None}, {'name': 'Simulation', 'id': 'GAME_SIMULATION'}, {'name': 'Management', 'id': None}, {'name': 'Tycoon', 'id': None}, {'name': 'Casual', 'id': 'GAME_CASUAL'}, {'name': 'Single player', 'id': None}, {'name': 'Stylized', 'id': None}, {'name': 'Cartoon', 'id': None}, {'name': 'Offline', 'id': None}, {'name': 'Simulation', 'id': 'GAME_SIMULATION'}, {'name': 'Care', 'id': None}, {'name': 'Pet', 'id': None}, {'name': 'Casual', 'id': 'GAME_CASUAL'}, {'name': 'Single player', 'id': None}, {'name': 'Stylized', 'id': None}, {'name': 'Cartoon', 'id': None}, {'name': 'Offline', 'id': None}, {'name': 'Puzzle', 'id': 'GAME_PUZZLE'}, {'name': 'Merge', 'id': None}, {'name': 'Casual', 'id': 'GAME_CASUAL'}, {'name': 'Single player', 'id': None}, {'name': 'Stylized', 'id': None}, {'name': 'Offline', 'id': None}, {'name': 'Simulation', 'id': 'GAME_SIMULATION'}, {'name': 'Care', 'id': None}, {'name': 'Pet', 'id': None}, {'name': 'Casual', 'id': 'GAME_CASUAL'}, {'name': 'Single player', 'id': None}, {'name': 'Stylized', 'id': None}, {'name': 'Cartoon', 'id': None}, {'name': 'Offline', 'id': None}, {'name': 'Simulation', 'id': 'GAME_SIMULATION'}, {'name': 'Care', 'id': None}, {'name': 'Pet', 'id': None}, {'name': 'Casual', 'id': 'GAME_CASUAL'}, {'name': 'Single player', 'id': None}, {'name': 'Stylized', 'id': None}, {'name': 'Offline', 'id': None}, {'name': 'Simulation', 'id': 'GAME_SIMULATION'}, {'name': 'Care', 'id': None}, {'name': 'Pet', 'id': None}, {'name': 'Casual', 'id': 'GAME_CASUAL'}, {'name': 'Single player', 'id': None}, {'name': 'Stylized', 'id': None}, {'name': 'Cartoon', 'id': None}, {'name': 'Offline', 'id': None}, {'name': 'Simulation', 'id': 'GAME_SIMULATION'}, {'name': 'Care', 'id': None}, {'name': 'Pet', 'id': None}, {'name': 'Casual', 'id': 'GAME_CASUAL'}, {'name': 'Single player', 'id': None}, {'name': 'Stylized', 'id': None}, {'name': 'Cartoon', 'id': None}, {'name': 'Offline', 'id': None}, {'name': 'Simulation', 'id': 'GAME_SIMULATION'}, {'name': 'Care', 'id': None}, {'name': 'Pet', 'id': None}, {'name': 'Casual', 'id': 'GAME_CASUAL'}, {'name': 'Single player', 'id': None}, {'name': 'Stylized', 'id': None}, {'name': 'Cartoon', 'id': None}, {'name': 'Offline', 'id': None}, {'name': 'Racing', 'id': 'GAME_RACING'}, {'name': 'Casual', 'id': 'GAME_CASUAL'}, {'name': 'Single player', 'id': None}, {'name': 'Stylized', 'id': None}, {'name': 'Pixelated', 'id': None}, {'name': 'Offline', 'id': None}, {'name': 'Simulation', 'id': 'GAME_SIMULATION'}, {'name': 'Care', 'id': None}, {'name': 'Pet', 'id': None}, {'name': 'Casual', 'id': 'GAME_CASUAL'}, {'name': 'Single player', 'id': None}, {'name': 'Stylized', 'id': None}, {'name': 'Simulation', 'id': 'GAME_SIMULATION'}, {'name': 'Idle', 'id': None}, {'name': 'Casual', 'id': 'GAME_CASUAL'}, {'name': 'Single player', 'id': None}, {'name': 'Stylized', 'id': None}, {'name': 'Cartoon', 'id': None}, {'name': 'Offline', 'id': None}, {'name': 'Simulation', 'id': 'GAME_SIMULATION'}, {'name': 'Management', 'id': None}, {'name': 'Tycoon', 'id': None}, {'name': 'Casual', 'id': 'GAME_CASUAL'}, {'name': 'Single player', 'id': None}, {'name': 'Stylized', 'id': None}, {'name': 'Offline', 'id': None}, {'name': 'Puzzle', 'id': 'GAME_PUZZLE'}, {'name': 'Merge', 'id': None}, {'name': 'Casual', 'id': 'GAME_CASUAL'}, {'name': 'Single player', 'id': None}, {'name': 'Stylized', 'id': None}, {'name': 'Cartoon', 'id': None}, {'name': 'Offline', 'id': None}, {'name': 'Simulation', 'id': 'GAME_SIMULATION'}, {'name': 'Care', 'id': None}, {'name': 'Pet', 'id': None}, {'name': 'Casual', 'id': 'GAME_CASUAL'}, {'name': 'Single player', 'id': None}, {'name': 'Stylized', 'id': None}, {'name': 'Offline', 'id': None}, {'name': 'Simulation', 'id': 'GAME_SIMULATION'}, {'name': 'Care', 'id': None}, {'name': 'Pet', 'id': None}, {'name': 'Casual', 'id': 'GAME_CASUAL'}, {'name': 'Single player', 'id': None}, {'name': 'Stylized', 'id': None}, {'name': 'Cartoon', 'id': None}, {'name': 'Offline', 'id': None}, {'name': 'Puzzle', 'id': 'GAME_PUZZLE'}, {'name': 'Merge', 'id': None}, {'name': 'Casual', 'id': 'GAME_CASUAL'}, {'name': 'Single player', 'id': None}, {'name': 'Stylized', 'id': None}, {'name': 'Offline', 'id': None}, {'name': 'Simulation', 'id': 'GAME_SIMULATION'}, {'name': 'Care', 'id': None}, {'name': 'Pet', 'id': None}, {'name': 'Simulation', 'id': 'GAME_SIMULATION'}, {'name': 'Life', 'id': None}, {'name': 'Casual', 'id': 'GAME_CASUAL'}, {'name': 'Multiplayer', 'id': None}, {'name': 'Competitive multiplayer', 'id': None}, {'name': 'Single player', 'id': None}, {'name': 'Stylized', 'id': None}, {'name': 'Offline', 'id': None}, {'name': 'Simulation', 'id': 'GAME_SIMULATION'}, {'name': 'Care', 'id': None}, {'name': 'Pet', 'id': None}, {'name': 'Casual', 'id': 'GAME_CASUAL'}, {'name': 'Single player', 'id': None}, {'name': 'Stylized', 'id': None}, {'name': 'Cartoon', 'id': None}, {'name': 'Offline', 'id': None}, {'name': 'Simulation', 'id': 'GAME_SIMULATION'}, {'name': 'Care', 'id': None}, {'name': 'Pet', 'id': None}, {'name': 'Casual', 'id': 'GAME_CASUAL'}, {'name': 'Single player', 'id': None}, {'name': 'Realistic', 'id': None}]",Rated for 18+,,True,True,"Jul 21, 2022",1691885467,4.12,"['Great app and presents well visually but always fails to send Notifications when receiving chat messages forcing you to manually check in on conversations.', 'Decent app, but would be more effective with more members- obviously not the fault of the developer, but still a shortcoming. Adding the option to delete chats would be good.', ""12 people are within my 50 mile radius. 7 of those people want to breed their dogs. 2 of those people want to date. And another 1 just wants a pet sitter. This app isnt regulated Edit: I did attempt to report these profiles. There wasn't a report option. Or it's incredibly difficult to find. Either or."", ""Won't use proper location. Locks when I try to update the location. Won't let me delete account."", 'Fantastic app loved all the people', 'Very user friendly app. A lot of great matches for my little Barky. Me and 🐕 really loving this app.', ""I love pawmates but they are the same dog s and no one manage me back but it's still a good app"", 'This is a great way to meet other pets. 5/5!!', 'Great app my dog loves it']",com.colin.barkerchat,https://play.google.com/store/apps/details?id=com.colin.barkerchat&hl=en&gl=jp,2023-08-23 13:25:04.635110,jp,en
