title,description,summary,installs,minInstalls,realInstalls,score,ratings,reviews,histogram,price,free,currency,sale,saleTime,originalPrice,saleText,offersIAP,inAppProductPrice,developer,developerId,developerEmail,developerWebsite,developerAddress,privacyPolicy,genre,genreId,categories,contentRating,contentRatingDescription,adSupported,containsAds,released,updated,version,comments,appId,url,searchMoment,countryCode,languageCode
DogDater,"Few animals are as social as our dog friends, yet no social App is devoted to THEIR needs for daily quality interactions until now! DogDater is an app created by dog lovers for dog lovers to help your dog flourish and find new friends. It allows you to follow and meet other dogs around the world regardless of where they are and based on your personal preferences such as breed, characteristics, and gender. 
The App includes lots of functions that will make your and your dog’s life happier: The yard allows you to stay up to date on what your favorite dogs are doing. You can also showcase your dog's life and news about it. You can create and join groups in your area or based on your dog's interests. This is a great way to connect with more dogs and to share tips and thoughts about your and others' dogs. You can also send direct messages to other dog owners and meet up, or recommend nice dog places, exciting parks, or any favorite dog accessories your dog might want to share with their friends. The App also makes it easy for you to keep track of your dog's family history, and find your dog's long-lost brothers and sisters.
We have just launched the App and are planning to add lots of exciting functions very soon, such as a marketplace, online courses, dog psychology, dog walking, dog sitting, parking, mating, and pedigrees for breeding all over the world. Welcome to DogDater The world's best community for dogs!",The App for all dog lovers. Find dogs around the world & around the corner.,"10,000+",10000,13673,0.0,0.0,0.0,"[0, 0, 0, 0, 0]",0,True,RUB,False,,,,False,,Dogdatr,Dogdatr,info@dogdater.com,https://dogdater.com,,https://dogdater.com/terms-of-service/,Communication,COMMUNICATION,"[{'name': 'Lifestyle', 'id': 'LIFESTYLE'}, {'name': 'Simulation', 'id': 'GAME_SIMULATION'}, {'name': 'Care', 'id': None}, {'name': 'Pet', 'id': None}, {'name': 'Casual', 'id': 'GAME_CASUAL'}, {'name': 'Single player', 'id': None}, {'name': 'Stylized', 'id': None}, {'name': 'Simulation', 'id': 'GAME_SIMULATION'}, {'name': 'Care', 'id': None}, {'name': 'Pet', 'id': None}, {'name': 'Casual', 'id': 'GAME_CASUAL'}, {'name': 'Single player', 'id': None}, {'name': 'Stylized', 'id': None}, {'name': 'Simulation', 'id': 'GAME_SIMULATION'}, {'name': 'Care', 'id': None}, {'name': 'Pet', 'id': None}, {'name': 'Casual', 'id': 'GAME_CASUAL'}, {'name': 'Single player', 'id': None}, {'name': 'Stylized', 'id': None}, {'name': 'Simulation', 'id': 'GAME_SIMULATION'}, {'name': 'Care', 'id': None}, {'name': 'Pet', 'id': None}, {'name': 'Casual', 'id': 'GAME_CASUAL'}, {'name': 'Single player', 'id': None}, {'name': 'Stylized', 'id': None}, {'name': 'Action', 'id': 'GAME_ACTION'}, {'name': 'Shooter', 'id': None}, {'name': 'Tactical shooter', 'id': None}, {'name': 'Casual', 'id': 'GAME_CASUAL'}, {'name': 'Stylized', 'id': None}, {'name': 'Simulation', 'id': 'GAME_SIMULATION'}, {'name': 'Idle', 'id': None}, {'name': 'Casual', 'id': 'GAME_CASUAL'}, {'name': 'Single player', 'id': None}, {'name': 'Stylized', 'id': None}, {'name': 'Cartoon', 'id': None}, {'name': 'Offline', 'id': None}, {'name': 'Simulation', 'id': 'GAME_SIMULATION'}, {'name': 'Idle', 'id': None}, {'name': 'Casual', 'id': 'GAME_CASUAL'}, {'name': 'Single player', 'id': None}, {'name': 'Stylized', 'id': None}, {'name': 'Cartoon', 'id': None}, {'name': 'Offline', 'id': None}, {'name': 'Simulation', 'id': 'GAME_SIMULATION'}, {'name': 'Care', 'id': None}, {'name': 'Pet', 'id': None}, {'name': 'Casual', 'id': 'GAME_CASUAL'}, {'name': 'Single player', 'id': None}, {'name': 'Stylized', 'id': None}, {'name': 'Simulation', 'id': 'GAME_SIMULATION'}, {'name': 'Idle', 'id': None}, {'name': 'Casual', 'id': 'GAME_CASUAL'}, {'name': 'Single player', 'id': None}, {'name': 'Stylized', 'id': None}, {'name': 'Cartoon', 'id': None}, {'name': 'Offline', 'id': None}, {'name': 'Simulation', 'id': 'GAME_SIMULATION'}, {'name': 'Idle', 'id': None}, {'name': 'Casual', 'id': 'GAME_CASUAL'}, {'name': 'Single player', 'id': None}, {'name': 'Stylized', 'id': None}, {'name': 'Cartoon', 'id': None}, {'name': 'Offline', 'id': None}, {'name': 'Simulation', 'id': 'GAME_SIMULATION'}, {'name': 'Idle', 'id': None}, {'name': 'Casual', 'id': 'GAME_CASUAL'}, {'name': 'Single player', 'id': None}, {'name': 'Stylized', 'id': None}, {'name': 'Cartoon', 'id': None}, {'name': 'Offline', 'id': None}, {'name': 'Simulation', 'id': 'GAME_SIMULATION'}, {'name': 'Idle', 'id': None}, {'name': 'Casual', 'id': 'GAME_CASUAL'}, {'name': 'Single player', 'id': None}, {'name': 'Stylized', 'id': None}, {'name': 'Cartoon', 'id': None}, {'name': 'Offline', 'id': None}, {'name': 'Simulation', 'id': 'GAME_SIMULATION'}, {'name': 'Idle', 'id': None}, {'name': 'Casual', 'id': 'GAME_CASUAL'}, {'name': 'Single player', 'id': None}, {'name': 'Stylized', 'id': None}, {'name': 'Cartoon', 'id': None}, {'name': 'Offline', 'id': None}, {'name': 'Action', 'id': 'GAME_ACTION'}, {'name': 'Shooter', 'id': None}, {'name': 'Tactical shooter', 'id': None}, {'name': 'Casual', 'id': 'GAME_CASUAL'}, {'name': 'Stylized', 'id': None}, {'name': 'Simulation', 'id': 'GAME_SIMULATION'}, {'name': 'Idle', 'id': None}, {'name': 'Casual', 'id': 'GAME_CASUAL'}, {'name': 'Single player', 'id': None}, {'name': 'Stylized', 'id': None}, {'name': 'Cartoon', 'id': None}, {'name': 'Offline', 'id': None}, {'name': 'Simulation', 'id': 'GAME_SIMULATION'}, {'name': 'Idle', 'id': None}, {'name': 'Casual', 'id': 'GAME_CASUAL'}, {'name': 'Single player', 'id': None}, {'name': 'Stylized', 'id': None}, {'name': 'Cartoon', 'id': None}, {'name': 'Offline', 'id': None}, {'name': 'Simulation', 'id': 'GAME_SIMULATION'}, {'name': 'Idle', 'id': None}, {'name': 'Casual', 'id': 'GAME_CASUAL'}, {'name': 'Single player', 'id': None}, {'name': 'Stylized', 'id': None}, {'name': 'Cartoon', 'id': None}, {'name': 'Offline', 'id': None}, {'name': 'Simulation', 'id': 'GAME_SIMULATION'}, {'name': 'Idle', 'id': None}, {'name': 'Casual', 'id': 'GAME_CASUAL'}, {'name': 'Single player', 'id': None}, {'name': 'Stylized', 'id': None}, {'name': 'Cartoon', 'id': None}, {'name': 'Offline', 'id': None}, {'name': 'Simulation', 'id': 'GAME_SIMULATION'}, {'name': 'Idle', 'id': None}, {'name': 'Casual', 'id': 'GAME_CASUAL'}, {'name': 'Single player', 'id': None}, {'name': 'Stylized', 'id': None}, {'name': 'Cartoon', 'id': None}, {'name': 'Offline', 'id': None}, {'name': 'Simulation', 'id': 'GAME_SIMULATION'}, {'name': 'Idle', 'id': None}, {'name': 'Casual', 'id': 'GAME_CASUAL'}, {'name': 'Single player', 'id': None}, {'name': 'Stylized', 'id': None}, {'name': 'Cartoon', 'id': None}, {'name': 'Offline', 'id': None}, {'name': 'Simulation', 'id': 'GAME_SIMULATION'}, {'name': 'Idle', 'id': None}, {'name': 'Casual', 'id': 'GAME_CASUAL'}, {'name': 'Single player', 'id': None}, {'name': 'Stylized', 'id': None}, {'name': 'Cartoon', 'id': None}, {'name': 'Offline', 'id': None}, {'name': 'Simulation', 'id': 'GAME_SIMULATION'}, {'name': 'Idle', 'id': None}, {'name': 'Casual', 'id': 'GAME_CASUAL'}, {'name': 'Single player', 'id': None}, {'name': 'Stylized', 'id': None}, {'name': 'Cartoon', 'id': None}, {'name': 'Offline', 'id': None}, {'name': 'Simulation', 'id': 'GAME_SIMULATION'}, {'name': 'Idle', 'id': None}, {'name': 'Casual', 'id': 'GAME_CASUAL'}, {'name': 'Single player', 'id': None}, {'name': 'Stylized', 'id': None}, {'name': 'Cartoon', 'id': None}, {'name': 'Offline', 'id': None}, {'name': 'Simulation', 'id': 'GAME_SIMULATION'}, {'name': 'Care', 'id': None}, {'name': 'Pet', 'id': None}, {'name': 'Casual', 'id': 'GAME_CASUAL'}, {'name': 'Single player', 'id': None}, {'name': 'Stylized', 'id': None}, {'name': 'Simulation', 'id': 'GAME_SIMULATION'}, {'name': 'Care', 'id': None}, {'name': 'Pet', 'id': None}, {'name': 'Casual', 'id': 'GAME_CASUAL'}, {'name': 'Single player', 'id': None}, {'name': 'Realistic', 'id': None}, {'name': 'Simulation', 'id': 'GAME_SIMULATION'}, {'name': 'Care', 'id': None}, {'name': 'Pet', 'id': None}, {'name': 'Casual', 'id': 'GAME_CASUAL'}, {'name': 'Single player', 'id': None}, {'name': 'Stylized', 'id': None}, {'name': 'Cartoon', 'id': None}, {'name': 'Offline', 'id': None}, {'name': 'Simulation', 'id': 'GAME_SIMULATION'}, {'name': 'Care', 'id': None}, {'name': 'Pet', 'id': None}, {'name': 'Casual', 'id': 'GAME_CASUAL'}, {'name': 'Single player', 'id': None}, {'name': 'Realistic', 'id': None}, {'name': 'Simulation', 'id': 'GAME_SIMULATION'}, {'name': 'Care', 'id': None}, {'name': 'Pet', 'id': None}, {'name': 'Casual', 'id': 'GAME_CASUAL'}, {'name': 'Single player', 'id': None}, {'name': 'Stylized', 'id': None}, {'name': 'Cartoon', 'id': None}, {'name': 'Offline', 'id': None}, {'name': 'Simulation', 'id': 'GAME_SIMULATION'}, {'name': 'Care', 'id': None}, {'name': 'Pet', 'id': None}, {'name': 'Casual', 'id': 'GAME_CASUAL'}, {'name': 'Single player', 'id': None}, {'name': 'Stylized', 'id': None}, {'name': 'Simulation', 'id': 'GAME_SIMULATION'}, {'name': 'Care', 'id': None}, {'name': 'Pet', 'id': None}, {'name': 'Casual', 'id': 'GAME_CASUAL'}, {'name': 'Single player', 'id': None}, {'name': 'Realistic', 'id': None}, {'name': 'Simulation', 'id': 'GAME_SIMULATION'}, {'name': 'Care', 'id': None}, {'name': 'Pet', 'id': None}, {'name': 'Casual', 'id': 'GAME_CASUAL'}, {'name': 'Single player', 'id': None}, {'name': 'Realistic', 'id': None}, {'name': 'Simulation', 'id': 'GAME_SIMULATION'}, {'name': 'Care', 'id': None}, {'name': 'Pet', 'id': None}, {'name': 'Casual', 'id': 'GAME_CASUAL'}, {'name': 'Single player', 'id': None}, {'name': 'Stylized', 'id': None}, {'name': 'Cartoon', 'id': None}, {'name': 'Offline', 'id': None}, {'name': 'Simulation', 'id': 'GAME_SIMULATION'}, {'name': 'Management', 'id': None}, {'name': 'Tycoon', 'id': None}, {'name': 'Casual', 'id': 'GAME_CASUAL'}, {'name': 'Single player', 'id': None}, {'name': 'Stylized', 'id': None}, {'name': 'Offline', 'id': None}, {'name': 'Simulation', 'id': 'GAME_SIMULATION'}, {'name': 'Care', 'id': None}, {'name': 'Pet', 'id': None}, {'name': 'Casual', 'id': 'GAME_CASUAL'}, {'name': 'Single player', 'id': None}, {'name': 'Stylized', 'id': None}, {'name': 'Offline', 'id': None}, {'name': 'Simulation', 'id': 'GAME_SIMULATION'}, {'name': 'Life', 'id': None}, {'name': 'Dating', 'id': None}, {'name': 'Casual', 'id': 'GAME_CASUAL'}, {'name': 'Single player', 'id': None}, {'name': 'Stylized', 'id': None}, {'name': 'Anime', 'id': None}, {'name': 'Simulation', 'id': 'GAME_SIMULATION'}, {'name': 'Care', 'id': None}, {'name': 'Pet', 'id': None}, {'name': 'Casual', 'id': 'GAME_CASUAL'}, {'name': 'Single player', 'id': None}, {'name': 'Stylized', 'id': None}, {'name': 'Cartoon', 'id': None}, {'name': 'Offline', 'id': None}, {'name': 'Racing', 'id': 'GAME_RACING'}, {'name': 'Casual', 'id': 'GAME_CASUAL'}, {'name': 'Single player', 'id': None}, {'name': 'Stylized', 'id': None}, {'name': 'Pixelated', 'id': None}, {'name': 'Offline', 'id': None}, {'name': 'Simulation', 'id': 'GAME_SIMULATION'}, {'name': 'Care', 'id': None}, {'name': 'Pet', 'id': None}, {'name': 'Casual', 'id': 'GAME_CASUAL'}, {'name': 'Single player', 'id': None}, {'name': 'Stylized', 'id': None}, {'name': 'Simulation', 'id': 'GAME_SIMULATION'}, {'name': 'Management', 'id': None}, {'name': 'Tycoon', 'id': None}, {'name': 'Casual', 'id': 'GAME_CASUAL'}, {'name': 'Single player', 'id': None}, {'name': 'Stylized', 'id': None}, {'name': 'Offline', 'id': None}, {'name': 'Simulation', 'id': 'GAME_SIMULATION'}, {'name': 'Care', 'id': None}, {'name': 'Pet', 'id': None}, {'name': 'Casual', 'id': 'GAME_CASUAL'}, {'name': 'Single player', 'id': None}, {'name': 'Stylized', 'id': None}, {'name': 'Offline', 'id': None}, {'name': 'Simulation', 'id': 'GAME_SIMULATION'}, {'name': 'Idle', 'id': None}, {'name': 'Casual', 'id': 'GAME_CASUAL'}, {'name': 'Single player', 'id': None}, {'name': 'Stylized', 'id': None}, {'name': 'Cartoon', 'id': None}, {'name': 'Offline', 'id': None}, {'name': 'Simulation', 'id': 'GAME_SIMULATION'}, {'name': 'Care', 'id': None}, {'name': 'Pet', 'id': None}, {'name': 'Casual', 'id': 'GAME_CASUAL'}, {'name': 'Single player', 'id': None}, {'name': 'Realistic', 'id': None}, {'name': 'Simulation', 'id': 'GAME_SIMULATION'}, {'name': 'Care', 'id': None}, {'name': 'Pet', 'id': None}, {'name': 'Casual', 'id': 'GAME_CASUAL'}, {'name': 'Single player', 'id': None}, {'name': 'Stylized', 'id': None}, {'name': 'Offline', 'id': None}, {'name': 'Simulation', 'id': 'GAME_SIMULATION'}, {'name': 'Life', 'id': None}, {'name': 'Dating', 'id': None}, {'name': 'Casual', 'id': 'GAME_CASUAL'}, {'name': 'Single player', 'id': None}, {'name': 'Stylized', 'id': None}, {'name': 'Anime', 'id': None}, {'name': 'Simulation', 'id': 'GAME_SIMULATION'}, {'name': 'Care', 'id': None}, {'name': 'Pet', 'id': None}, {'name': 'Casual', 'id': 'GAME_CASUAL'}, {'name': 'Single player', 'id': None}, {'name': 'Stylized', 'id': None}, {'name': 'Cartoon', 'id': None}, {'name': 'Offline', 'id': None}, {'name': 'Simulation', 'id': 'GAME_SIMULATION'}, {'name': 'Care', 'id': None}, {'name': 'Pet', 'id': None}, {'name': 'Casual', 'id': 'GAME_CASUAL'}, {'name': 'Single player', 'id': None}, {'name': 'Stylized', 'id': None}, {'name': 'Cartoon', 'id': None}, {'name': 'Offline', 'id': None}, {'name': 'Simulation', 'id': 'GAME_SIMULATION'}, {'name': 'Care', 'id': None}, {'name': 'Pet', 'id': None}, {'name': 'Casual', 'id': 'GAME_CASUAL'}, {'name': 'Single player', 'id': None}, {'name': 'Stylized', 'id': None}, {'name': 'Offline', 'id': None}, {'name': 'Simulation', 'id': 'GAME_SIMULATION'}, {'name': 'Care', 'id': None}, {'name': 'Pet', 'id': None}, {'name': 'Casual', 'id': 'GAME_CASUAL'}, {'name': 'Single player', 'id': None}, {'name': 'Stylized', 'id': None}, {'name': 'Cartoon', 'id': None}, {'name': 'Offline', 'id': None}, {'name': 'Simulation', 'id': 'GAME_SIMULATION'}, {'name': 'Management', 'id': None}, {'name': 'Tycoon', 'id': None}, {'name': 'Casual', 'id': 'GAME_CASUAL'}, {'name': 'Single player', 'id': None}, {'name': 'Stylized', 'id': None}, {'name': 'Offline', 'id': None}, {'name': 'Simulation', 'id': 'GAME_SIMULATION'}, {'name': 'Care', 'id': None}, {'name': 'Pet', 'id': None}, {'name': 'Casual', 'id': 'GAME_CASUAL'}, {'name': 'Single player', 'id': None}, {'name': 'Realistic', 'id': None}, {'name': 'Simulation', 'id': 'GAME_SIMULATION'}, {'name': 'Idle', 'id': None}, {'name': 'Casual', 'id': 'GAME_CASUAL'}, {'name': 'Single player', 'id': None}, {'name': 'Stylized', 'id': None}, {'name': 'Cartoon', 'id': None}, {'name': 'Offline', 'id': None}, {'name': 'Simulation', 'id': 'GAME_SIMULATION'}, {'name': 'Care', 'id': None}, {'name': 'Pet', 'id': None}, {'name': 'Casual', 'id': 'GAME_CASUAL'}, {'name': 'Single player', 'id': None}, {'name': 'Stylized', 'id': None}, {'name': 'Puzzle', 'id': 'GAME_PUZZLE'}, {'name': 'Merge', 'id': None}, {'name': 'Casual', 'id': 'GAME_CASUAL'}, {'name': 'Single player', 'id': None}, {'name': 'Stylized', 'id': None}, {'name': 'Cartoon', 'id': None}, {'name': 'Offline', 'id': None}, {'name': 'Simulation', 'id': 'GAME_SIMULATION'}, {'name': 'Life', 'id': None}, {'name': 'Dating', 'id': None}, {'name': 'Casual', 'id': 'GAME_CASUAL'}, {'name': 'Single player', 'id': None}, {'name': 'Stylized', 'id': None}, {'name': 'Anime', 'id': None}, {'name': 'Trivia', 'id': 'GAME_TRIVIA'}, {'name': 'Casual', 'id': 'GAME_CASUAL'}, {'name': 'Single player', 'id': None}, {'name': 'Realistic', 'id': None}, {'name': 'Simulation', 'id': 'GAME_SIMULATION'}, {'name': 'Care', 'id': None}, {'name': 'Pet', 'id': None}, {'name': 'Casual', 'id': 'GAME_CASUAL'}, {'name': 'Single player', 'id': None}, {'name': 'Stylized', 'id': None}, {'name': 'Cartoon', 'id': None}, {'name': 'Offline', 'id': None}, {'name': 'Puzzle', 'id': 'GAME_PUZZLE'}, {'name': 'Merge', 'id': None}, {'name': 'Casual', 'id': 'GAME_CASUAL'}, {'name': 'Single player', 'id': None}, {'name': 'Stylized', 'id': None}, {'name': 'Offline', 'id': None}, {'name': 'Simulation', 'id': 'GAME_SIMULATION'}, {'name': 'Care', 'id': None}, {'name': 'Pet', 'id': None}, {'name': 'Casual', 'id': 'GAME_CASUAL'}, {'name': 'Single player', 'id': None}, {'name': 'Stylized', 'id': None}, {'name': 'Simulation', 'id': 'GAME_SIMULATION'}, {'name': 'Management', 'id': None}, {'name': 'Tycoon', 'id': None}, {'name': 'Casual', 'id': 'GAME_CASUAL'}, {'name': 'Single player', 'id': None}, {'name': 'Stylized', 'id': None}, {'name': 'Offline', 'id': None}, {'name': 'Simulation', 'id': 'GAME_SIMULATION'}, {'name': 'Life', 'id': None}, {'name': 'Dating', 'id': None}, {'name': 'Casual', 'id': 'GAME_CASUAL'}, {'name': 'Single player', 'id': None}, {'name': 'Stylized', 'id': None}, {'name': 'Anime', 'id': None}, {'name': 'Puzzle', 'id': 'GAME_PUZZLE'}, {'name': 'Match 3', 'id': None}, {'name': 'Casual', 'id': 'GAME_CASUAL'}, {'name': 'Single player', 'id': None}, {'name': 'Stylized', 'id': None}, {'name': 'Offline', 'id': None}, {'name': 'Simulation', 'id': 'GAME_SIMULATION'}, {'name': 'Care', 'id': None}, {'name': 'Pet', 'id': None}, {'name': 'Casual', 'id': 'GAME_CASUAL'}, {'name': 'Single player', 'id': None}, {'name': 'Realistic', 'id': None}, {'name': 'Simulation', 'id': 'GAME_SIMULATION'}, {'name': 'Care', 'id': None}, {'name': 'Pet', 'id': None}, {'name': 'Casual', 'id': 'GAME_CASUAL'}, {'name': 'Single player', 'id': None}, {'name': 'Stylized', 'id': None}, {'name': 'Cartoon', 'id': None}, {'name': 'Offline', 'id': None}, {'name': 'Trivia', 'id': 'GAME_TRIVIA'}, {'name': 'Casual', 'id': 'GAME_CASUAL'}, {'name': 'Single player', 'id': None}, {'name': 'Realistic', 'id': None}, {'name': 'Simulation', 'id': 'GAME_SIMULATION'}, {'name': 'Care', 'id': None}, {'name': 'Pet', 'id': None}, {'name': 'Casual', 'id': 'GAME_CASUAL'}, {'name': 'Single player', 'id': None}, {'name': 'Realistic', 'id': None}, {'name': 'Simulation', 'id': 'GAME_SIMULATION'}, {'name': 'Management', 'id': None}, {'name': 'Tycoon', 'id': None}, {'name': 'Casual', 'id': 'GAME_CASUAL'}, {'name': 'Single player', 'id': None}, {'name': 'Stylized', 'id': None}, {'name': 'Cartoon', 'id': None}, {'name': 'Offline', 'id': None}, {'name': 'Simulation', 'id': 'GAME_SIMULATION'}, {'name': 'Care', 'id': None}, {'name': 'Pet', 'id': None}, {'name': 'Casual', 'id': 'GAME_CASUAL'}, {'name': 'Single player', 'id': None}, {'name': 'Stylized', 'id': None}, {'name': 'Cartoon', 'id': None}, {'name': 'Offline', 'id': None}, {'name': 'Puzzle', 'id': 'GAME_PUZZLE'}, {'name': 'Merge', 'id': None}, {'name': 'Casual', 'id': 'GAME_CASUAL'}, {'name': 'Single player', 'id': None}, {'name': 'Stylized', 'id': None}, {'name': 'Offline', 'id': None}, {'name': 'Simulation', 'id': 'GAME_SIMULATION'}, {'name': 'Care', 'id': None}, {'name': 'Pet', 'id': None}, {'name': 'Casual', 'id': 'GAME_CASUAL'}, {'name': 'Single player', 'id': None}, {'name': 'Stylized', 'id': None}, {'name': 'Cartoon', 'id': None}, {'name': 'Offline', 'id': None}, {'name': 'Simulation', 'id': 'GAME_SIMULATION'}, {'name': 'Care', 'id': None}, {'name': 'Pet', 'id': None}, {'name': 'Casual', 'id': 'GAME_CASUAL'}, {'name': 'Single player', 'id': None}, {'name': 'Stylized', 'id': None}, {'name': 'Offline', 'id': None}, {'name': 'Simulation', 'id': 'GAME_SIMULATION'}, {'name': 'Care', 'id': None}, {'name': 'Pet', 'id': None}, {'name': 'Casual', 'id': 'GAME_CASUAL'}, {'name': 'Single player', 'id': None}, {'name': 'Stylized', 'id': None}, {'name': 'Cartoon', 'id': None}, {'name': 'Offline', 'id': None}, {'name': 'Simulation', 'id': 'GAME_SIMULATION'}, {'name': 'Care', 'id': None}, {'name': 'Pet', 'id': None}, {'name': 'Casual', 'id': 'GAME_CASUAL'}, {'name': 'Single player', 'id': None}, {'name': 'Stylized', 'id': None}, {'name': 'Cartoon', 'id': None}, {'name': 'Offline', 'id': None}]",Rated for 12+,Parental Guidance Recommended,False,False,"Sep 22, 2021",1689944670,2.4.2,"[""The only people that are popping up for me are swedish, not a single person from any where else, I'm not sure if this is because of the only people on this app are living in Sweden or I've set something up wrong or this app has messed up, anyways would be great if people were more local"", ""Not really usable for me without the option to search in a specific area in the city. I'm not gonna commute with my two dogs, one of them with arthritis, to meet another dog. I understand it might work for other people, but it is a very simple feature to add an address to the account information and be able to search based on that. You basically already have that with the city..."", 'Fantastic app. Really been waiting for an app like this. Thank you for making it happen!']",com.dogdatr.app,https://play.google.com/store/apps/details?id=com.dogdatr.app&hl=en&gl=ru,2023-08-23 13:24:13.884493,ru,en
