title,description,summary,installs,minInstalls,realInstalls,score,ratings,reviews,histogram,price,free,currency,sale,saleTime,originalPrice,saleText,offersIAP,inAppProductPrice,developer,developerId,developerEmail,developerWebsite,developerAddress,privacyPolicy,genre,genreId,categories,contentRating,contentRatingDescription,adSupported,containsAds,released,updated,version,comments,appId,url,searchMoment,countryCode,languageCode
Merge Dogs,"Merge your dogs, build the ultimate dog racing team and win the race!

Do you have what it takes to be the best dog racer out there? Start by getting small puppies, then upgrade them into bigger faster dogs and earn lots of money!

Features:
- Over 20 different dog breeds to discover including shiba inu, corgi, golden retriever, pug, french bulldog, chihuahua, poodle, beagle, dachshund, dalmatian, dobermann, rottweiler and lots more!
- Idle earnings. Gain coins even while you are away or offline.

Manage your team of super fast dogs. Start your dog racing team now and become a champion!",Build your doggy team and win the race!,"1,000,000+",1000000,3776871,4.5947137,72397.0,1848.0,"[3343, 1903, 2863, 4462, 59792]",0,True,RUB,False,,,,True,RUB 99.00 - RUB 199.00 per item,Zepni Ltd.,8999339140632122257,contact@zepni.com,http://www.zepni.com,"Lane 72, No. 73, 2F, Guangfu S Road, Taipei City 106, Taiwan",https://www.zepni.com/mergedogsprivacypolicy,Simulation,GAME_SIMULATION,"[{'name': 'Lifestyle', 'id': 'LIFESTYLE'}, {'name': 'Simulation', 'id': 'GAME_SIMULATION'}, {'name': 'Care', 'id': None}, {'name': 'Pet', 'id': None}, {'name': 'Casual', 'id': 'GAME_CASUAL'}, {'name': 'Single player', 'id': None}, {'name': 'Stylized', 'id': None}, {'name': 'Simulation', 'id': 'GAME_SIMULATION'}, {'name': 'Care', 'id': None}, {'name': 'Pet', 'id': None}, {'name': 'Casual', 'id': 'GAME_CASUAL'}, {'name': 'Single player', 'id': None}, {'name': 'Stylized', 'id': None}, {'name': 'Simulation', 'id': 'GAME_SIMULATION'}, {'name': 'Care', 'id': None}, {'name': 'Pet', 'id': None}, {'name': 'Casual', 'id': 'GAME_CASUAL'}, {'name': 'Single player', 'id': None}, {'name': 'Stylized', 'id': None}, {'name': 'Simulation', 'id': 'GAME_SIMULATION'}, {'name': 'Care', 'id': None}, {'name': 'Pet', 'id': None}, {'name': 'Casual', 'id': 'GAME_CASUAL'}, {'name': 'Single player', 'id': None}, {'name': 'Stylized', 'id': None}, {'name': 'Action', 'id': 'GAME_ACTION'}, {'name': 'Shooter', 'id': None}, {'name': 'Tactical shooter', 'id': None}, {'name': 'Casual', 'id': 'GAME_CASUAL'}, {'name': 'Stylized', 'id': None}, {'name': 'Simulation', 'id': 'GAME_SIMULATION'}, {'name': 'Idle', 'id': None}, {'name': 'Casual', 'id': 'GAME_CASUAL'}, {'name': 'Single player', 'id': None}, {'name': 'Stylized', 'id': None}, {'name': 'Cartoon', 'id': None}, {'name': 'Offline', 'id': None}, {'name': 'Simulation', 'id': 'GAME_SIMULATION'}, {'name': 'Idle', 'id': None}, {'name': 'Casual', 'id': 'GAME_CASUAL'}, {'name': 'Single player', 'id': None}, {'name': 'Stylized', 'id': None}, {'name': 'Cartoon', 'id': None}, {'name': 'Offline', 'id': None}, {'name': 'Simulation', 'id': 'GAME_SIMULATION'}, {'name': 'Care', 'id': None}, {'name': 'Pet', 'id': None}, {'name': 'Casual', 'id': 'GAME_CASUAL'}, {'name': 'Single player', 'id': None}, {'name': 'Stylized', 'id': None}, {'name': 'Simulation', 'id': 'GAME_SIMULATION'}, {'name': 'Idle', 'id': None}, {'name': 'Casual', 'id': 'GAME_CASUAL'}, {'name': 'Single player', 'id': None}, {'name': 'Stylized', 'id': None}, {'name': 'Cartoon', 'id': None}, {'name': 'Offline', 'id': None}, {'name': 'Simulation', 'id': 'GAME_SIMULATION'}, {'name': 'Idle', 'id': None}, {'name': 'Casual', 'id': 'GAME_CASUAL'}, {'name': 'Single player', 'id': None}, {'name': 'Stylized', 'id': None}, {'name': 'Cartoon', 'id': None}, {'name': 'Offline', 'id': None}, {'name': 'Simulation', 'id': 'GAME_SIMULATION'}, {'name': 'Idle', 'id': None}, {'name': 'Casual', 'id': 'GAME_CASUAL'}, {'name': 'Single player', 'id': None}, {'name': 'Stylized', 'id': None}, {'name': 'Cartoon', 'id': None}, {'name': 'Offline', 'id': None}, {'name': 'Simulation', 'id': 'GAME_SIMULATION'}, {'name': 'Idle', 'id': None}, {'name': 'Casual', 'id': 'GAME_CASUAL'}, {'name': 'Single player', 'id': None}, {'name': 'Stylized', 'id': None}, {'name': 'Cartoon', 'id': None}, {'name': 'Offline', 'id': None}, {'name': 'Simulation', 'id': 'GAME_SIMULATION'}, {'name': 'Idle', 'id': None}, {'name': 'Casual', 'id': 'GAME_CASUAL'}, {'name': 'Single player', 'id': None}, {'name': 'Stylized', 'id': None}, {'name': 'Cartoon', 'id': None}, {'name': 'Offline', 'id': None}, {'name': 'Action', 'id': 'GAME_ACTION'}, {'name': 'Shooter', 'id': None}, {'name': 'Tactical shooter', 'id': None}, {'name': 'Casual', 'id': 'GAME_CASUAL'}, {'name': 'Stylized', 'id': None}, {'name': 'Simulation', 'id': 'GAME_SIMULATION'}, {'name': 'Idle', 'id': None}, {'name': 'Casual', 'id': 'GAME_CASUAL'}, {'name': 'Single player', 'id': None}, {'name': 'Stylized', 'id': None}, {'name': 'Cartoon', 'id': None}, {'name': 'Offline', 'id': None}, {'name': 'Simulation', 'id': 'GAME_SIMULATION'}, {'name': 'Idle', 'id': None}, {'name': 'Casual', 'id': 'GAME_CASUAL'}, {'name': 'Single player', 'id': None}, {'name': 'Stylized', 'id': None}, {'name': 'Cartoon', 'id': None}, {'name': 'Offline', 'id': None}, {'name': 'Simulation', 'id': 'GAME_SIMULATION'}, {'name': 'Idle', 'id': None}, {'name': 'Casual', 'id': 'GAME_CASUAL'}, {'name': 'Single player', 'id': None}, {'name': 'Stylized', 'id': None}, {'name': 'Cartoon', 'id': None}, {'name': 'Offline', 'id': None}, {'name': 'Simulation', 'id': 'GAME_SIMULATION'}, {'name': 'Idle', 'id': None}, {'name': 'Casual', 'id': 'GAME_CASUAL'}, {'name': 'Single player', 'id': None}, {'name': 'Stylized', 'id': None}, {'name': 'Cartoon', 'id': None}, {'name': 'Offline', 'id': None}, {'name': 'Simulation', 'id': 'GAME_SIMULATION'}, {'name': 'Idle', 'id': None}, {'name': 'Casual', 'id': 'GAME_CASUAL'}, {'name': 'Single player', 'id': None}, {'name': 'Stylized', 'id': None}, {'name': 'Cartoon', 'id': None}, {'name': 'Offline', 'id': None}, {'name': 'Simulation', 'id': 'GAME_SIMULATION'}, {'name': 'Idle', 'id': None}, {'name': 'Casual', 'id': 'GAME_CASUAL'}, {'name': 'Single player', 'id': None}, {'name': 'Stylized', 'id': None}, {'name': 'Cartoon', 'id': None}, {'name': 'Offline', 'id': None}, {'name': 'Simulation', 'id': 'GAME_SIMULATION'}, {'name': 'Idle', 'id': None}, {'name': 'Casual', 'id': 'GAME_CASUAL'}, {'name': 'Single player', 'id': None}, {'name': 'Stylized', 'id': None}, {'name': 'Cartoon', 'id': None}, {'name': 'Offline', 'id': None}, {'name': 'Simulation', 'id': 'GAME_SIMULATION'}, {'name': 'Idle', 'id': None}, {'name': 'Casual', 'id': 'GAME_CASUAL'}, {'name': 'Single player', 'id': None}, {'name': 'Stylized', 'id': None}, {'name': 'Cartoon', 'id': None}, {'name': 'Offline', 'id': None}, {'name': 'Simulation', 'id': 'GAME_SIMULATION'}, {'name': 'Idle', 'id': None}, {'name': 'Casual', 'id': 'GAME_CASUAL'}, {'name': 'Single player', 'id': None}, {'name': 'Stylized', 'id': None}, {'name': 'Cartoon', 'id': None}, {'name': 'Offline', 'id': None}, {'name': 'Simulation', 'id': 'GAME_SIMULATION'}, {'name': 'Care', 'id': None}, {'name': 'Pet', 'id': None}, {'name': 'Casual', 'id': 'GAME_CASUAL'}, {'name': 'Single player', 'id': None}, {'name': 'Stylized', 'id': None}, {'name': 'Simulation', 'id': 'GAME_SIMULATION'}, {'name': 'Care', 'id': None}, {'name': 'Pet', 'id': None}, {'name': 'Casual', 'id': 'GAME_CASUAL'}, {'name': 'Single player', 'id': None}, {'name': 'Realistic', 'id': None}, {'name': 'Simulation', 'id': 'GAME_SIMULATION'}, {'name': 'Care', 'id': None}, {'name': 'Pet', 'id': None}, {'name': 'Casual', 'id': 'GAME_CASUAL'}, {'name': 'Single player', 'id': None}, {'name': 'Stylized', 'id': None}, {'name': 'Cartoon', 'id': None}, {'name': 'Offline', 'id': None}, {'name': 'Simulation', 'id': 'GAME_SIMULATION'}, {'name': 'Care', 'id': None}, {'name': 'Pet', 'id': None}, {'name': 'Casual', 'id': 'GAME_CASUAL'}, {'name': 'Single player', 'id': None}, {'name': 'Realistic', 'id': None}, {'name': 'Simulation', 'id': 'GAME_SIMULATION'}, {'name': 'Care', 'id': None}, {'name': 'Pet', 'id': None}, {'name': 'Casual', 'id': 'GAME_CASUAL'}, {'name': 'Single player', 'id': None}, {'name': 'Stylized', 'id': None}, {'name': 'Cartoon', 'id': None}, {'name': 'Offline', 'id': None}, {'name': 'Simulation', 'id': 'GAME_SIMULATION'}, {'name': 'Care', 'id': None}, {'name': 'Pet', 'id': None}, {'name': 'Casual', 'id': 'GAME_CASUAL'}, {'name': 'Single player', 'id': None}, {'name': 'Stylized', 'id': None}, {'name': 'Simulation', 'id': 'GAME_SIMULATION'}, {'name': 'Care', 'id': None}, {'name': 'Pet', 'id': None}, {'name': 'Casual', 'id': 'GAME_CASUAL'}, {'name': 'Single player', 'id': None}, {'name': 'Realistic', 'id': None}, {'name': 'Simulation', 'id': 'GAME_SIMULATION'}, {'name': 'Care', 'id': None}, {'name': 'Pet', 'id': None}, {'name': 'Casual', 'id': 'GAME_CASUAL'}, {'name': 'Single player', 'id': None}, {'name': 'Realistic', 'id': None}, {'name': 'Simulation', 'id': 'GAME_SIMULATION'}, {'name': 'Care', 'id': None}, {'name': 'Pet', 'id': None}, {'name': 'Casual', 'id': 'GAME_CASUAL'}, {'name': 'Single player', 'id': None}, {'name': 'Stylized', 'id': None}, {'name': 'Cartoon', 'id': None}, {'name': 'Offline', 'id': None}, {'name': 'Simulation', 'id': 'GAME_SIMULATION'}, {'name': 'Management', 'id': None}, {'name': 'Tycoon', 'id': None}, {'name': 'Casual', 'id': 'GAME_CASUAL'}, {'name': 'Single player', 'id': None}, {'name': 'Stylized', 'id': None}, {'name': 'Offline', 'id': None}, {'name': 'Simulation', 'id': 'GAME_SIMULATION'}, {'name': 'Care', 'id': None}, {'name': 'Pet', 'id': None}, {'name': 'Casual', 'id': 'GAME_CASUAL'}, {'name': 'Single player', 'id': None}, {'name': 'Stylized', 'id': None}, {'name': 'Offline', 'id': None}, {'name': 'Simulation', 'id': 'GAME_SIMULATION'}, {'name': 'Life', 'id': None}, {'name': 'Dating', 'id': None}, {'name': 'Casual', 'id': 'GAME_CASUAL'}, {'name': 'Single player', 'id': None}, {'name': 'Stylized', 'id': None}, {'name': 'Anime', 'id': None}, {'name': 'Simulation', 'id': 'GAME_SIMULATION'}, {'name': 'Care', 'id': None}, {'name': 'Pet', 'id': None}, {'name': 'Casual', 'id': 'GAME_CASUAL'}, {'name': 'Single player', 'id': None}, {'name': 'Stylized', 'id': None}, {'name': 'Cartoon', 'id': None}, {'name': 'Offline', 'id': None}, {'name': 'Racing', 'id': 'GAME_RACING'}, {'name': 'Casual', 'id': 'GAME_CASUAL'}, {'name': 'Single player', 'id': None}, {'name': 'Stylized', 'id': None}, {'name': 'Pixelated', 'id': None}, {'name': 'Offline', 'id': None}, {'name': 'Simulation', 'id': 'GAME_SIMULATION'}, {'name': 'Care', 'id': None}, {'name': 'Pet', 'id': None}, {'name': 'Casual', 'id': 'GAME_CASUAL'}, {'name': 'Single player', 'id': None}, {'name': 'Stylized', 'id': None}, {'name': 'Simulation', 'id': 'GAME_SIMULATION'}, {'name': 'Management', 'id': None}, {'name': 'Tycoon', 'id': None}, {'name': 'Casual', 'id': 'GAME_CASUAL'}, {'name': 'Single player', 'id': None}, {'name': 'Stylized', 'id': None}, {'name': 'Offline', 'id': None}, {'name': 'Simulation', 'id': 'GAME_SIMULATION'}, {'name': 'Care', 'id': None}, {'name': 'Pet', 'id': None}, {'name': 'Casual', 'id': 'GAME_CASUAL'}, {'name': 'Single player', 'id': None}, {'name': 'Stylized', 'id': None}, {'name': 'Offline', 'id': None}, {'name': 'Simulation', 'id': 'GAME_SIMULATION'}, {'name': 'Idle', 'id': None}, {'name': 'Casual', 'id': 'GAME_CASUAL'}, {'name': 'Single player', 'id': None}, {'name': 'Stylized', 'id': None}, {'name': 'Cartoon', 'id': None}, {'name': 'Offline', 'id': None}, {'name': 'Simulation', 'id': 'GAME_SIMULATION'}, {'name': 'Care', 'id': None}, {'name': 'Pet', 'id': None}, {'name': 'Casual', 'id': 'GAME_CASUAL'}, {'name': 'Single player', 'id': None}, {'name': 'Realistic', 'id': None}, {'name': 'Simulation', 'id': 'GAME_SIMULATION'}, {'name': 'Care', 'id': None}, {'name': 'Pet', 'id': None}, {'name': 'Casual', 'id': 'GAME_CASUAL'}, {'name': 'Single player', 'id': None}, {'name': 'Stylized', 'id': None}, {'name': 'Offline', 'id': None}, {'name': 'Simulation', 'id': 'GAME_SIMULATION'}, {'name': 'Life', 'id': None}, {'name': 'Dating', 'id': None}, {'name': 'Casual', 'id': 'GAME_CASUAL'}, {'name': 'Single player', 'id': None}, {'name': 'Stylized', 'id': None}, {'name': 'Anime', 'id': None}, {'name': 'Simulation', 'id': 'GAME_SIMULATION'}, {'name': 'Care', 'id': None}, {'name': 'Pet', 'id': None}, {'name': 'Casual', 'id': 'GAME_CASUAL'}, {'name': 'Single player', 'id': None}, {'name': 'Stylized', 'id': None}, {'name': 'Cartoon', 'id': None}, {'name': 'Offline', 'id': None}, {'name': 'Simulation', 'id': 'GAME_SIMULATION'}, {'name': 'Care', 'id': None}, {'name': 'Pet', 'id': None}, {'name': 'Casual', 'id': 'GAME_CASUAL'}, {'name': 'Single player', 'id': None}, {'name': 'Stylized', 'id': None}, {'name': 'Cartoon', 'id': None}, {'name': 'Offline', 'id': None}, {'name': 'Simulation', 'id': 'GAME_SIMULATION'}, {'name': 'Care', 'id': None}, {'name': 'Pet', 'id': None}, {'name': 'Casual', 'id': 'GAME_CASUAL'}, {'name': 'Single player', 'id': None}, {'name': 'Stylized', 'id': None}, {'name': 'Offline', 'id': None}, {'name': 'Simulation', 'id': 'GAME_SIMULATION'}, {'name': 'Care', 'id': None}, {'name': 'Pet', 'id': None}, {'name': 'Casual', 'id': 'GAME_CASUAL'}, {'name': 'Single player', 'id': None}, {'name': 'Stylized', 'id': None}, {'name': 'Cartoon', 'id': None}, {'name': 'Offline', 'id': None}, {'name': 'Simulation', 'id': 'GAME_SIMULATION'}, {'name': 'Management', 'id': None}, {'name': 'Tycoon', 'id': None}, {'name': 'Casual', 'id': 'GAME_CASUAL'}, {'name': 'Single player', 'id': None}, {'name': 'Stylized', 'id': None}, {'name': 'Offline', 'id': None}, {'name': 'Simulation', 'id': 'GAME_SIMULATION'}, {'name': 'Care', 'id': None}, {'name': 'Pet', 'id': None}, {'name': 'Casual', 'id': 'GAME_CASUAL'}, {'name': 'Single player', 'id': None}, {'name': 'Realistic', 'id': None}, {'name': 'Simulation', 'id': 'GAME_SIMULATION'}, {'name': 'Idle', 'id': None}, {'name': 'Casual', 'id': 'GAME_CASUAL'}, {'name': 'Single player', 'id': None}, {'name': 'Stylized', 'id': None}, {'name': 'Cartoon', 'id': None}, {'name': 'Offline', 'id': None}, {'name': 'Simulation', 'id': 'GAME_SIMULATION'}, {'name': 'Care', 'id': None}, {'name': 'Pet', 'id': None}, {'name': 'Casual', 'id': 'GAME_CASUAL'}, {'name': 'Single player', 'id': None}, {'name': 'Stylized', 'id': None}, {'name': 'Puzzle', 'id': 'GAME_PUZZLE'}, {'name': 'Merge', 'id': None}, {'name': 'Casual', 'id': 'GAME_CASUAL'}, {'name': 'Single player', 'id': None}, {'name': 'Stylized', 'id': None}, {'name': 'Cartoon', 'id': None}, {'name': 'Offline', 'id': None}, {'name': 'Simulation', 'id': 'GAME_SIMULATION'}, {'name': 'Life', 'id': None}, {'name': 'Dating', 'id': None}, {'name': 'Casual', 'id': 'GAME_CASUAL'}, {'name': 'Single player', 'id': None}, {'name': 'Stylized', 'id': None}, {'name': 'Anime', 'id': None}, {'name': 'Trivia', 'id': 'GAME_TRIVIA'}, {'name': 'Casual', 'id': 'GAME_CASUAL'}, {'name': 'Single player', 'id': None}, {'name': 'Realistic', 'id': None}, {'name': 'Simulation', 'id': 'GAME_SIMULATION'}, {'name': 'Care', 'id': None}, {'name': 'Pet', 'id': None}, {'name': 'Casual', 'id': 'GAME_CASUAL'}, {'name': 'Single player', 'id': None}, {'name': 'Stylized', 'id': None}, {'name': 'Cartoon', 'id': None}, {'name': 'Offline', 'id': None}, {'name': 'Puzzle', 'id': 'GAME_PUZZLE'}, {'name': 'Merge', 'id': None}, {'name': 'Casual', 'id': 'GAME_CASUAL'}, {'name': 'Single player', 'id': None}, {'name': 'Stylized', 'id': None}, {'name': 'Offline', 'id': None}, {'name': 'Simulation', 'id': 'GAME_SIMULATION'}, {'name': 'Care', 'id': None}, {'name': 'Pet', 'id': None}, {'name': 'Casual', 'id': 'GAME_CASUAL'}, {'name': 'Single player', 'id': None}, {'name': 'Stylized', 'id': None}, {'name': 'Simulation', 'id': 'GAME_SIMULATION'}, {'name': 'Management', 'id': None}, {'name': 'Tycoon', 'id': None}, {'name': 'Casual', 'id': 'GAME_CASUAL'}, {'name': 'Single player', 'id': None}, {'name': 'Stylized', 'id': None}, {'name': 'Offline', 'id': None}, {'name': 'Simulation', 'id': 'GAME_SIMULATION'}, {'name': 'Life', 'id': None}, {'name': 'Dating', 'id': None}, {'name': 'Casual', 'id': 'GAME_CASUAL'}, {'name': 'Single player', 'id': None}, {'name': 'Stylized', 'id': None}, {'name': 'Anime', 'id': None}, {'name': 'Puzzle', 'id': 'GAME_PUZZLE'}, {'name': 'Match 3', 'id': None}, {'name': 'Casual', 'id': 'GAME_CASUAL'}, {'name': 'Single player', 'id': None}, {'name': 'Stylized', 'id': None}, {'name': 'Offline', 'id': None}, {'name': 'Simulation', 'id': 'GAME_SIMULATION'}, {'name': 'Care', 'id': None}, {'name': 'Pet', 'id': None}, {'name': 'Casual', 'id': 'GAME_CASUAL'}, {'name': 'Single player', 'id': None}, {'name': 'Realistic', 'id': None}, {'name': 'Simulation', 'id': 'GAME_SIMULATION'}, {'name': 'Care', 'id': None}, {'name': 'Pet', 'id': None}, {'name': 'Casual', 'id': 'GAME_CASUAL'}, {'name': 'Single player', 'id': None}, {'name': 'Stylized', 'id': None}, {'name': 'Cartoon', 'id': None}, {'name': 'Offline', 'id': None}, {'name': 'Trivia', 'id': 'GAME_TRIVIA'}, {'name': 'Casual', 'id': 'GAME_CASUAL'}, {'name': 'Single player', 'id': None}, {'name': 'Realistic', 'id': None}, {'name': 'Simulation', 'id': 'GAME_SIMULATION'}, {'name': 'Care', 'id': None}, {'name': 'Pet', 'id': None}, {'name': 'Casual', 'id': 'GAME_CASUAL'}, {'name': 'Single player', 'id': None}, {'name': 'Realistic', 'id': None}, {'name': 'Simulation', 'id': 'GAME_SIMULATION'}, {'name': 'Management', 'id': None}, {'name': 'Tycoon', 'id': None}, {'name': 'Casual', 'id': 'GAME_CASUAL'}, {'name': 'Single player', 'id': None}, {'name': 'Stylized', 'id': None}, {'name': 'Cartoon', 'id': None}, {'name': 'Offline', 'id': None}, {'name': 'Simulation', 'id': 'GAME_SIMULATION'}, {'name': 'Care', 'id': None}, {'name': 'Pet', 'id': None}, {'name': 'Casual', 'id': 'GAME_CASUAL'}, {'name': 'Single player', 'id': None}, {'name': 'Stylized', 'id': None}, {'name': 'Cartoon', 'id': None}, {'name': 'Offline', 'id': None}, {'name': 'Puzzle', 'id': 'GAME_PUZZLE'}, {'name': 'Merge', 'id': None}, {'name': 'Casual', 'id': 'GAME_CASUAL'}, {'name': 'Single player', 'id': None}, {'name': 'Stylized', 'id': None}, {'name': 'Offline', 'id': None}, {'name': 'Simulation', 'id': 'GAME_SIMULATION'}, {'name': 'Care', 'id': None}, {'name': 'Pet', 'id': None}, {'name': 'Casual', 'id': 'GAME_CASUAL'}, {'name': 'Single player', 'id': None}, {'name': 'Stylized', 'id': None}, {'name': 'Cartoon', 'id': None}, {'name': 'Offline', 'id': None}, {'name': 'Simulation', 'id': 'GAME_SIMULATION'}, {'name': 'Care', 'id': None}, {'name': 'Pet', 'id': None}, {'name': 'Casual', 'id': 'GAME_CASUAL'}, {'name': 'Single player', 'id': None}, {'name': 'Stylized', 'id': None}, {'name': 'Offline', 'id': None}, {'name': 'Simulation', 'id': 'GAME_SIMULATION'}, {'name': 'Care', 'id': None}, {'name': 'Pet', 'id': None}, {'name': 'Casual', 'id': 'GAME_CASUAL'}, {'name': 'Single player', 'id': None}, {'name': 'Stylized', 'id': None}, {'name': 'Cartoon', 'id': None}, {'name': 'Offline', 'id': None}, {'name': 'Simulation', 'id': 'GAME_SIMULATION'}, {'name': 'Care', 'id': None}, {'name': 'Pet', 'id': None}, {'name': 'Casual', 'id': 'GAME_CASUAL'}, {'name': 'Single player', 'id': None}, {'name': 'Stylized', 'id': None}, {'name': 'Cartoon', 'id': None}, {'name': 'Offline', 'id': None}]",Rated for 3+,,True,True,"Oct 5, 2018",1678813392,2.0.2,"['The design of everything is very simple and cute. The animations and feel of it is very happy. You do have to wait, but the animations help for the wait time since the animation entertains you as you wait. A very fun game overall. Perfect for people who like achievin', ""This game was fun at first but it starts playing you when your about the finish the game like not giving you your money and taking your good dogs and replacing them with bad ones ( for example there are 5 pages and I was on the husky on the 4th page and they replaced it with a dog from the fourth page) which may not seem like a big deal but the higher the dog the more epband money so replacing it so you get less and have to wait months for a new dog This game is just impractical don't waste time"", ""Starts off fun but after you gather a few dog species it becomes very difficult to move in to the next species. especially because the money you gather while the app is off is limited. Fun but has more potential. I've dropped it now."", 'Very addictive. As a dog person this game is perfect for me. If you are a dog person you should download Merge Dogs! The graphics are great. So many new types of dogs to collect. I have used the 2x speed. It is one of the best money makers in the game. The 5 star review has been earned. Download right now!', 'It\'s ok... a bit confusing at first figuring out what to do and what the purpose is of having the dogs run laps in circles... keep thinking they\'re going to get tired and get thirsty... thought it was going to be more like a ""real merge three"" game, not merge two or more. I do however enjoy ""creating"" the new dog species! it is original, but it needs improvements overall. gets repetitive and lacks incentive after awhile. but I think many people would like it with a clear explanation of what it is', ""Really good game it gets kind of boring because it's just a loop you get a dog you merge the dog then again. I think it's a very good game though."", ""I love everything but could get lil boring rarely adds don't have to pay money it's good 😊 one thing though there is bugs like sometimes one of the dogs was tiny and hard to see maybe see what's wrong? I recommend the game though ;)"", ""This game is amazing! There are rarely ads, and the dogs are super cute! The only thing is that it gets boring sometimes but that's okay! PLEASE download this app!!!"", ""Alright, so, I really enjoyed this game at first. It was super fun, really cute, definitely addictive. However... I'm about halfway through the catalogue both for the grass track and the snow track, and now it's boring. It takes too long to get to the bigger dogs, since you only get two hours of away time. There's an upgrade for two more but... Do I wanna pay to still barely be able to buy two dogs at a higher tier? There just isn't enough to do to keep it fun. Good for a while tho!"", ""This game started out lots of fun and I was always excited to see all the new dogs you could unlock but as you get into the later stages, sometimes my best dogs are randomly deleted and replaced, I have been playing for a long while so it takes weeks and months to get a new dog but they keep getting replaced before I can get a new dog, it does it often and it's impossible to progress through the game at this point. It takes away from the cute aspects. Example; Lost my Samoyed for a Dalmatian."", 'This is a good mindless game to pass the time, it helped me fall asleep. A tutorial would have been nice, I played for days before I figured it to click on the dogs and rabbits. The look of the pit bull was disappointing. All the dogs are very happy looking except him. The devs had an opportunity to put the beautiful dogs in a positive light and they took a wrong turn with it. Last, I beat both levels in just over a week, more levels would be awesome. I am uninstalling for now.', 'okay. i love the colours and the art style used! they really compliment each other and make the game enjoyable. i REALLY like the ability to buy certain dogs as you level up!! that makes it a lot easier but still challenging enough to keep playing! one thing i would like would be the ability to purchase outfits for certain dogs, with in game watch to earn ads, and ingame cash from the dogs. overall this game is great ✌️', ""Addicting and fun, until the ads stopped working, except, of course, the ads that provide zero benefits, which also happen extremely often now. I tried restarting the app multiple times. No luck. Fix this soon or I will delete. I already had to skip a bunch of rewards that I can't get anymore because I could have gotten them by watching an ad. Not satisfied at all... :( UPDATE: They sort of fixed the issue. I can get a reward from a video once, then I need to restart the app, so 3 from 2 stars."", 'This game is great! So fun! When i downloaded it at first i was a bit skeptical thinking about how hard it would be to get more dogs when i got pretty far in the game but i actually enjoy the way they set it up greatly! How you let the dogs run to collect more coins. Its creative and a good way to not run out as well as you dont have to buy coins or watch ads for them! 😁 Love the game! Addicting, easy, and loads of fun!', ""The game isn't really challenging for the mind. Buy a dog, for ever increasing prices, or wait for a free one. Let it run on the track to make money. Combine two of same to get another dog, of a higher level. That one will get you the same income as the two old dogs, only faster, so merging dogs is usually worth it. The rest (free dogs, 20% discount, double speed) is click bait, you get something and the designers earn money. But in the ent, it's surprisingly funny and addictive. I quite like it."", 'I love this game the only thing I wish they could improve is how long you have to merge the dogs. Anyways the whole rest of the game is great!😊', 'This game is amazing and I love it. I stayed up late playing this game!! It is awesome!! I recommend it to whoever is looking at this. If you like offline games... This is for you! All you have to do to get rid of the ads is turn off your mobile data (if you have that) or turn off your interet! Then no ads. It does load, but dont worry. This is a 5 star rating!!! Love it so much. Again you can always get rid of the ads by turning off internet or mobile data. Anyway, thats my review! 🥰🐶🐕🐕\u200d🦺', 'MAGNIFIC DOG MERGE GAME 🐕 good work. Thank you! 🐩 I was about to finish the game, so I uninstall it to restart it, so much it is relaxing and awesome . 💕', ""This game was fun but you need to add a tutorial for new player's but it does help me fall asleep."", ""its a cute game, and the dogs models are adorable. it has a short, simple tutorial which is nice. I just don't like how long it takes to upgrade to the next dog. it's a slow-paced game compared to most idle games but that's not a horrible thing. the in-game purchases are also a bit overpriced. I love it as a time passer, but I'm uninstalling."", ""It's a cute game but it just feels so plain and basic. At least in Merge Planes you could get boosters, etc for the track, and there was a leader board. I don't want to watch fifty million ads just to make my dogs go faster, etc. And they don't even go that fast with the ads. Plus, the ads don't always work. You need to do more to this otherwise boring game."", ""It's a cute app, but is it fun? sort of, at your lowest stage it's fun and you merge but soon it becomes into a log on, collect reward, buy more dogs, close app, repeat. I do like that the ads aren't forced but I do watch them anyway. 1 video to double my 2 billion? sure why not. most people won't like this but I do like grind fest games. so it's cute and it's grindy, following the popular trend of merge apps. with not anything else thrown in to spice it up, that's about it."", ""The cutest game I've played so far. The game is very simple and really good for destressing. Animation is cute, and I get excited every time I get a new dog. I'm unable to play ads though so I can't redeem other features. But overall the game is just really chill and enjoyable."", 'This is a great game. But I have a problem, my progress keeps getting lost! I was at the level were I unlocked the sheltie but I come back the next day and it is gone, i still unlocked it in the book of dogs but did not have it on the track. I probably wont get a reply or a bot reply I just hope that this problem gets fixed.', 'I wanted to like this game, but there are a few things that turned me off. First of which was the farther I got in the game, the speed in which the dogs speed around the track literally made me sick. Visually it was disturbing and maybe should come with a warning. The second thing is why is the pitbull the only vicious looking design. All the other breeds look super sweet and friendly. I think the designers are perpetuating an unfair bias.', 'Fun game, but a while ago(long time) i had much progress on the game when it randomly crashed and wouldnt open, this went on for a week until i gave up. When it finally let me play it deleted most of my progress. It is now crashing again and im thinking it will do what it did previously, nice app, but please fix it so it doesnt delete progress, or atleast let us save it somehow.(im on latest version so that cant be why.)', ""This app is so so cute and fun!! But it has a bug that happened to me twice. I don't know how that happened but it was in the snow place that my fastest dog lost two times. So I have to use more money and it's so hard because of slower income because of the bug. And also the away time says I'll get my income for 4 hours when I don't use the app but it's just actually 4 minutes. I was supposed to earn at least a trillion in 4 hours but it just gives me 50 billion. It's a fun game though. = )"", 'Stopped playing it last year because constant crashes made it impossible to play. Felt the urge to play it again and glad to see that the crashes have been fixed! Cute and fun way to pass the time!', ""Thia game is an adorable idle merge game, there's enough factors that go into each dog that give the game more depth than expected, and I love that it has multiple worlds or zones that play at the same time. The only thing I think the game is lacking is a more solid active playing aspect, I'd like to see some kind of minigame alongside the idle aspects, but it's still a complete game that is worth your time."", ""Like the game as a way to kill time. Got to Pom, and it looked like it was floating? Thought nothing of it and continued to play, only to find that when I got a 2nd Pom, they wouldn't merge. Closed the app and restarted - my 2nd Pom is going and the Pom I have has been taken off the track. This has happened twice now."", ""I think that the game was very simple and easy. It was very short thought. You barley got any dogs and most other breeds can be left out. I know it is kinda tricky to find nonpopular breeds of dogs, but I still think it's great. To the game creaters, you should make one with cats and the different breeds also. I think the game was very cute and I enjoyed it."", ""well.. I liked this game, it was fun to merge the lil doggos to get more doggos. BUT. After getting over half the doggos in the regular one and almost completing the snow one, the game continuously crashes. I open it and not even 2 seconds later it crashes. Not enough time for me to do anything. It's super frustrating because I'm just so close to finishing it. I put a lot of effort into this."", ""It's an easy game to pass the time with. But a few too many ads for my liking. It's ok to have ads for bonus things like the 2x speed but i don't like that one automatically plays for 5 seconds when i close the buy-a-dog screen."", 'The music is great👍 and very happy 😊! I love the dogs 🐕 ❤ and they are very cute 😍! the racing is adorable ❤!', ""great game, I'm enjoying unlocking so many great breeds of dogs. the ads are a bit much but I'm not even mad considering you can use it for speeding up money, leveling up to a higher breed when using money, but it randomly comes up when you arent clicking anything that would start an ad and it gets quite annoy when an ad appears for no reason."", 'after a while you can no longer watch ads because the dogs are going so fast, so every time an ad tried to pop up, you have to watch your dogs run behind a loading screen for about 5-10 seconds.. I miss the ""watch an ad to make them go 2x as fast!"" or ""watch an ad to get the next level of dog!"" so yeah, the process is becoming a lot slower but I still love to poke the doggos. its actually quite addicting considering it gets laggy after a while', ""Love it! Super cute and fun! However!!! It doesn't do a good job at conveying some things. Things like the X2 multiplier lasts 2 minutes and 30 seconds. And it doesn't tell you how much your max away is. All it tells you is that you'll get 2 more hours of max away if you pay them real cash money. A bit unnecessarily annoying."", 'I love the game so much it is a cute doggy game I love I how you can get different dogs my favorite so far that I have is my best one the dalmation. I love this game! Update) I would like a ""Save"" feature. I recently uninstalled (For storage and realized ""oh fu-"".) Reinstalled and lost my progress. If you could add a save feature so i can reload my work would be nice, If its already there then ;-;-', ""Got months of playtime out of this. Simple idler with ROCK SOLID design. Art is adorable, control is intuitive, and lots of dogs means it last you a while. A few design elements raise its quality of life as time goes on: The quick-buy button (not real $) for the smallest dog eventually moves up the ladder as you unlock new dogs, so merge chains don't become impossibly long slogs. And you can always tap the dogs on your track for a little extra speed/cash. My new benchmark for merge-style games."", 'A Great Game! So much fun! At first when i downloaded it looked skeptical and confusing thinking about how hard it would be to get more dogs but when i got a bit far in the game, i actually enjoyed the way it was set up. Love the game, Addicting, easy and lots of funs.']",com.zepni.dog,https://play.google.com/store/apps/details?id=com.zepni.dog&hl=en&gl=ru,2023-08-23 13:24:28.470131,ru,en
